Title;Actors;MovieLength;Genre;Director;ReleaseDate;Description;ThumbNail
Inception;Leonardo DiCaprio,Joseph Gordon-Levitt,Ellen Page,Tom Hardy,Cillian Murphy;148;Sci-Fi/Action;Christopher Nolan;2010-07-16;A thief enters the dreams of others to steal their secrets.;ThumbNails/inception_resized.jpg
The Shawshank Redemption;Tim Robbins,Morgan Freeman,Bob Gunton,William Sadler;142;Drama;Frank Darabont;1994-09-23;Two imprisoned men bond over several years, finding solace and eventual redemption through acts of common decency.;ThumbNails/shawshank_resized.jpg
The Godfather;Marlon Brando,Al Pacino,James Caan,Richard S. Castellano;175;Crime/Film-Noir;Francis Ford Coppola;1972-03-15;The aging patriarch of an organized crime dynasty transfers control of his clandestine empire to his reluctant son.;ThumbNails/godfather_resized.jpg
Pulp Fiction;John Travolta,Samuel L. Jackson,Uma Thurman,Bruce Willis;154;Crime/Drama;Quentin Tarantino;1994-09-10;Various interconnected stories of crime, redemption, and the search for a mysterious briefcase unfold in Los Angeles.;ThumbNails/pulpfiction_resized.jpg
The Dark Knight;Christian Bale,Heath Ledger,Aaron Eckhart,Michael Caine;152;Action/Crime/Thriller;Christopher Nolan;2008-07-18;Batman faces the Joker, a criminal mastermind with a twisted sense of humor, in a battle to save Gotham City.;ThumbNails/darkknight_resized.jpg
Forrest Gump;Tom Hanks,Robin Wright,Gary Sinise,Sally Field;142;Drama/Romance;Robert Zemeckis;1994-07-06;A man with a low IQ witnesses and unwittingly influences several defining historical events in the 20th century.;ThumbNails/forrest_resized.jpg
Titanic;Leonardo DiCaprio,Kate Winslet,Billy Zane,Kathy Bates;195;Drama/Romance;James Cameron;1997-12-19;A love story between two passengers aboard the ill-fated maiden voyage of the Titanic.;ThumbNails/titanic_resized.jpg
The Matrix;Keanu Reeves,Laurence Fishburne,Carrie-Anne Moss,Hugo Weaving;136;Action/Sci-Fi;Lana Wachowski;1999-03-24;A computer hacker learns about the true nature of his reality and his role in the war against the machines.;ThumbNails/matrix_resized.jpg
The Lord of the Rings: The Fellowship of the Ring;Elijah Wood,Ian McKellen,Orlando Bloom,Viggo Mortensen;178;Action/Adventure/Drama;Peter Jackson;2001-12-19;A hobbit and his companions set out to destroy a powerful ring to prevent an evil lord from taking over the world.;ThumbNails/lotr_resized.jpg